{
  "formatVersion": "1.0",
  "title": "Throne of Ashes",
  "exportedAt": "2025-11-08T18:24:07Z",
  "missions": [
    {
      "id": 1,
      "variant": "girl",
      "location": "Ashenport Docks",
      "relative": {
        "name": "Niece Pina",
        "category": "children"
      },
      "narrative": {
        "revelationOrMilestone": "Shaman appears; mission brief begins."
      },
      "enemies": [
        "Frost Lynxes",
        "Bollock Raider"
      ],
      "boss": {
        "name": "General Krath",
        "weakness": "Vulnerable during thunder; stun on lightning pylons"
      },
      "mission": {
        "hook": "Rescue Niece Pina from Ashenport Docks. They hold intel for next location.",
        "mapFeatures": "Vent tunnels",
        "stealthTip": "Cut lanterns to deepen shadows."
      },
      "rewards": {
        "powerUnlocked": "Blink Step (short-range teleport)"
      },
      "guidance": {
        "shamanWisdom": "Power without purpose is a candle in storm—shield your flame."
      }
    },
    {
      "id": 2,
      "variant": "girl",
      "location": "Obsidian Bazaar",
      "relative": {
        "name": "Uncle Joran",
        "category": "men"
      },
      "narrative": {
        "revelationOrMilestone": "Family secret revealed: player is heir to the lost throne."
      },
      "enemies": [
        "Swarm Spiders",
        "Iron Mauler"
      ],
      "boss": {
        "name": "Matron Vess",
        "weakness": "Mirror shields reflect her beam; strike from behind"
      },
      "mission": {
        "hook": "Rescue Uncle Joran from Obsidian Bazaar. They hold intel for next location.",
        "mapFeatures": "Hidden cistern",
        "stealthTip": "Whistle near bells to misdirect patrols."
      },
      "rewards": {
        "powerUnlocked": "Whirlwind Nova (360° knockback)"
      },
      "guidance": {
        "shamanWisdom": "When wolves circle, become the wind, not the tree."
      }
    },
    {
      "id": 3,
      "variant": "girl",
      "location": "Sapphire Cliffs",
      "relative": {
        "name": "Aunt Leena",
        "category": "women"
      },
      "narrative": {
        "revelationOrMilestone": ""
      },
      "enemies": [
        "Razor Eagles",
        "Rift Scout",
        "Dread Corsair"
      ],
      "boss": {
        "name": "Dreadsmith Orun",
        "weakness": "Armor overheats near forges; use water barrels"
      },
      "mission": {
        "hook": "Rescue Aunt Leena from Sapphire Cliffs. They hold intel for next location.",
        "mapFeatures": "Rooftop ziplines",
        "stealthTip": "Drop jars to lure wardens away."
      },
      "rewards": {
        "powerUnlocked": "Shadow Veil (10s invisibility)"
      },
      "guidance": {
        "shamanWisdom": "Every fortress has a forgotten vein; feel for its pulse."
      }
    },
    {
      "id": 4,
      "variant": "girl",
      "location": "Ember Hollow",
      "relative": {
        "name": "Nephew Iko",
        "category": "children"
      },
      "narrative": {
        "revelationOrMilestone": ""
      },
      "enemies": [
        "Frost Lynxes",
        "Hex Warlock"
      ],
      "boss": {
        "name": "High Warlock Zev",
        "weakness": "Interrupt chant with sonic arrows"
      },
      "mission": {
        "hook": "Rescue Nephew Iko from Ember Hollow. They hold intel for next location.",
        "mapFeatures": "Sewer ladder",
        "stealthTip": "Swim the culvert; bypass main gate."
      },
      "rewards": {
        "powerUnlocked": "Aerial Glide (long jump/fall control)"
      },
      "guidance": {
        "shamanWisdom": "Listen for lies in the quiet between war drums."
      }
    },
    {
      "id": 5,
      "variant": "girl",
      "location": "Verdant Sprawl",
      "relative": {
        "name": "Cousin Lumo",
        "category": "children"
      },
      "narrative": {
        "revelationOrMilestone": ""
      },
      "enemies": [
        "Frost Lynxes",
        "Hex Warlock"
      ],
      "boss": {
        "name": "Giant Golem Rauk",
        "weakness": "Cracks when frozen then shattered"
      },
      "mission": {
        "hook": "Rescue Cousin Lumo from Verdant Sprawl. They hold intel for next location.",
        "mapFeatures": "Collapsed tramway",
        "stealthTip": "Mask steps with thunderclaps."
      },
      "rewards": {
        "powerUnlocked": "Hawkeye Burst (multi-target auto-bow volley)"
      },
      "guidance": {
        "shamanWisdom": "Mercy is a blade—wield it or sheath it with intent."
      }
    },
    {
      "id": 6,
      "variant": "girl",
      "location": "Gale Citadel",
      "relative": {
        "name": "Cousin Rini",
        "category": "children"
      },
      "narrative": {
        "revelationOrMilestone": ""
      },
      "enemies": [
        "Ash Scorpions",
        "Bollock Raider",
        "Dread Corsair"
      ],
      "boss": {
        "name": "Corsair Queen Nyra",
        "weakness": "Harpoons jam the ship engine; board aft"
      },
      "mission": {
        "hook": "Rescue Cousin Rini from Gale Citadel. They hold intel for next location.",
        "mapFeatures": "Crate labyrinth",
        "stealthTip": "Shadow Archers can be pickpocketed for keys."
      },
      "rewards": {
        "powerUnlocked": "Stoneguard (temporary invulnerability)"
      },
      "guidance": {
        "shamanWisdom": "The sky carries you if you leap with wisdom."
      }
    },
    {
      "id": 7,
      "variant": "girl",
      "location": "Moonveil Ruins",
      "relative": {
        "name": "Brother Kael",
        "category": "men"
      },
      "narrative": {
        "revelationOrMilestone": ""
      },
      "enemies": [
        "Blight Boars",
        "Shadow Archer"
      ],
      "boss": {
        "name": "Bonebreaker Hul",
        "weakness": "Only staggers after parry-perfect 3 times"
      },
      "mission": {
        "hook": "Rescue Brother Kael from Moonveil Ruins. They hold intel for next location.",
        "mapFeatures": "Sub-basement vault",
        "stealthTip": "Ride supply carts through gatehouse."
      },
      "rewards": {
        "powerUnlocked": "Spectral Decoy (lures enemies)"
      },
      "guidance": {
        "shamanWisdom": "Your blood remembers thrones; let your heart remember people."
      }
    },
    {
      "id": 8,
      "variant": "girl",
      "location": "Crimson Steppe",
      "relative": {
        "name": "Niece Sumi",
        "category": "children"
      },
      "narrative": {
        "revelationOrMilestone": ""
      },
      "enemies": [
        "Grim Bears",
        "Rift Scout"
      ],
      "boss": {
        "name": "Warden Keth",
        "weakness": "Keys hidden on hawks; shoot them down"
      },
      "mission": {
        "hook": "Rescue Niece Sumi from Crimson Steppe. They hold intel for next location.",
        "mapFeatures": "Crack-in-wall passage",
        "stealthTip": "Sabotage alarm drums before entry."
      },
      "rewards": {
        "powerUnlocked": "Thunderbrand (charged sword cleave)"
      },
      "guidance": {
        "shamanWisdom": "A map shows walls; breath finds doors."
      }
    },
    {
      "id": 9,
      "variant": "girl",
      "location": "Ironroot Mines",
      "relative": {
        "name": "Nephew Tajo",
        "category": "children"
      },
      "narrative": {
        "revelationOrMilestone": ""
      },
      "enemies": [
        "Tide Serpents",
        "Rift Scout",
        "Crimson Pyromancer"
      ],
      "boss": {
        "name": "Storm Titan Oxx",
        "weakness": "Grounded by conductive chains"
      },
      "mission": {
        "hook": "Rescue Nephew Tajo from Ironroot Mines. They hold intel for next location.",
        "mapFeatures": "Cistern sluice",
        "stealthTip": "Poison stew pots to thin numbers."
      },
      "rewards": {
        "powerUnlocked": "Ember Dash (flame dash, ignites oil)"
      },
      "guidance": {
        "shamanWisdom": "Count the steps of your fear, then step once more."
      }
    },
    {
      "id": 10,
      "variant": "girl",
      "location": "Stormglass Keep",
      "relative": {
        "name": "Cousin Miri",
        "category": "children"
      },
      "narrative": {
        "revelationOrMilestone": ""
      },
      "enemies": [
        "Swarm Spiders",
        "Bollock Raider"
      ],
      "boss": {
        "name": "Beastmother Siva",
        "weakness": "Distract cubs; strike when she turns"
      },
      "mission": {
        "hook": "Rescue Cousin Miri from Stormglass Keep. They hold intel for next location.",
        "mapFeatures": "Ceiling rafters",
        "stealthTip": "Scale ivy to the watchtower, avoid spotlight."
      },
      "rewards": {
        "powerUnlocked": "Frostlock (freeze cone)"
      },
      "guidance": {
        "shamanWisdom": "Even giants drown in inches of truth."
      }
    },
    {
      "id": 11,
      "variant": "girl",
      "location": "Dune Sea Outpost",
      "relative": {
        "name": "Cousin Poro",
        "category": "children"
      },
      "narrative": {
        "revelationOrMilestone": ""
      },
      "enemies": [
        "Blight Boars",
        "Hex Warlock"
      ],
      "boss": {
        "name": "General Krath",
        "weakness": "Vulnerable during thunder; stun on lightning pylons"
      },
      "mission": {
        "hook": "Rescue Cousin Poro from Dune Sea Outpost. They hold intel for next location.",
        "mapFeatures": "Chimney shaft",
        "stealthTip": "Cut lanterns to deepen shadows."
      },
      "rewards": {
        "powerUnlocked": "Chain Grapple (pull to ledges/enemies)"
      },
      "guidance": {
        "shamanWisdom": "Power without purpose is a candle in storm—shield your flame."
      }
    },
    {
      "id": 12,
      "variant": "girl",
      "location": "Rivergate",
      "relative": {
        "name": "Sister Mira",
        "category": "women"
      },
      "narrative": {